{
  "schema_version": "0.1",
  "id": "ticket-1",
  "project_id": "project",
  "revision": 1,
  "source": "luuna_sqlite_temporary",
  "title": "Implement the greeting",
  "intent": "Make src/main.py print the greeting.",
  "acceptance_criteria": [
    "main prints the greeting"
  ],
  "repository_ids": [
    "app"
  ],
  "created_at": "2026-10-17T00:00:00.000Z",
  "updated_at": "2026-10-17T00:00:00.000Z"
}
